{"benchmark_id":"system-one-quality-heldout-1","record_count":10,"blinded":true,"criteria":["primary claim and location","official data and acquisition evidence","system mapping","unit mapping","measurement and baseline mapping","inference and validation-gap mapping","fragility and alternative explanation","independent check or explicit infeasibility","material mismatch and correct gate disposition","future System-2 verdict is discriminating, claim-bounded, and action-specific"],"target_pass_rate":{"minimum":0.8,"maximum":0.9},"status":"predeclared-not-run"}
